{
  "$id": "https://github.com/dcapal/dcapal/blob/master/dcapal-backend/docs/schema/portfolio/v1/schema.json",
  "$schema": "https://json-schema.org/draft-07/schema",
  "description": "DcaPal Portfolio",
  "type": "object",
  "required": [
    "quoteCcy",
    "assets"
  ],
  "properties": {
    "name": {
      "description": "Portfolio name",
      "type": "string",
      "minLength": 1
    },
    "quoteCcy": {
      "description": "Portfolio currency",
      "$ref": "#/$defs/fiatCurrency"
    },
    "fees": {
      "$ref": "#/$defs/transactionFees"
    },
    "assets": {
      "description": "Portfolio assets",
      "type": "array",
      "items": {
        "$ref": "#/$defs/asset"
      },
      "uniqueItems": true
    }
  },
  "additionalProperties": false,
  "$defs": {
    "fiatCurrency": {
      "type": "string",
      "enum": [
        "usd",
        "eur",
        "gbp",
        "chf",
        "jpy",
        "cad",
        "aed",
        "aud"
      ]
    },
    "percentage": {
      "description": "Decimal percentage represented as a string",
      "type": "string",
      "pattern": "^[0-9]+(?:\\.[0-9]+)?$"
    },
    "transactionFees": {
      "description": "Transaction fees",
      "type": "object",
      "required": [
        "feeStructure"
      ],
      "properties": {
        "maxFeeImpact": {
          "description": "Max acceptable fees impact on the allocation",
          "$ref": "#/$defs/percentage"
        },
        "feeStructure": {
          "description": "Fee structure",
          "type": "object",
          "oneOf": [
            {
              "properties": {
                "type": {
                  "const": "zeroFee"
                }
              },
              "required": [
                "type"
              ]
            },
            {
              "properties": {
                "type": {
                  "const": "fixed"
                },
                "feeAmount": {
                  "description": "Transaction fee amount",
                  "type": "string",
                  "pattern": "^[0-9]+(?:\\.[0-9]+)?$"
                }
              },
              "required": [
                "type",
                "feeAmount"
              ]
            },
            {
              "properties": {
                "type": {
                  "const": "variable"
                },
                "feeRate": {
                  "description": "Transaction fee rate (in percentage)",
                  "$ref": "#/$defs/percentage"
                },
                "minFee": {
                  "description": "Transaction fee minimum amount",
                  "type": "string",
                  "pattern": "^[0-9]+(?:\\.[0-9]+)?$"
                },
                "maxFee": {
                  "description": "Transaction fee maximum amount",
                  "type": "string",
                  "pattern": "^[0-9]+(?:\\.[0-9]+)?$"
                }
              },
              "required": [
                "type",
                "feeRate",
                "minFee"
              ]
            }
          ]
        }
      },
      "additionalProperties": false
    },
    "asset": {
      "description": "Portfolio asset",
      "type": "object",
      "required": [
        "symbol",
        "name",
        "aclass",
        "baseCcy",
        "price",
        "qty",
        "targetWeight",
        "provider"
      ],
      "properties": {
        "symbol": {
          "description": "Asset ticker",
          "type": "string",
          "minLength": 1
        },
        "name": {
          "description": "Asset name",
          "type": "string",
          "minLength": 1
        },
        "aclass": {
          "description": "Asset class. Matching is case-insensitive. Supported aliases are Equity, Bond, Cash, Currency, Crypto, Commodity, and Other; unknown values are stored as Other.",
          "type": "string",
          "enum": [
            "EQUITY",
            "BOND",
            "CURRENCY",
            "CASH",
            "CRYPTO",
            "COMMODITY",
            "OTHER",
            "Equity",
            "Bond",
            "Cash",
            "Currency",
            "Crypto",
            "Commodity",
            "Other"
          ]
        },
        "baseCcy": {
          "description": "Asset base currency",
          "type": "string",
          "minLength": 1
        },
        "price": {
          "description": "Asset price",
          "type": "string",
          "pattern": "^[0-9]+(?:\\.[0-9]+)?$"
        },
        "qty": {
          "description": "Number of units of the asset in portfolio",
          "type": "string",
          "pattern": "^[0-9]+(?:\\.[0-9]+)?$"
        },
        "targetWeight": {
          "description": "Asset target weight",
          "type": "string",
          "pattern": "^[0-9]+(?:\\.[0-9]+)?$"
        },
        "provider": {
          "description": "Price provider. Matching is case-insensitive. Accepted aliases are DCAPal and Kraken for Kraken-backed assets, and YF and Yahoo for Yahoo Finance-backed assets. Choose DCAPal for Crypto and YF for anything else.",
          "type": "string",
          "enum": [
            "DCAPal",
            "Kraken",
            "YF",
            "Yahoo"
          ]
        },
        "fees": {
          "$ref": "#/$defs/transactionFees"
        }
      }
    }
  }
}
